{
  "businessType": "Estudio de belleza",
  "tagline": "Rituales de cuidado con intención",
  "headline": "Un momento para volver a ti",
  "description": "Manicure, pedicure y rituales de cuidado en un espacio sereno, con atención precisa y una experiencia pensada de principio a fin.",
  "cta": {
    "label": "Reservar por teléfono",
    "href": "tel:+525500000000"
  },
  "phone": {
    "display": "+52 55 0000 0000",
    "href": "tel:+525500000000"
  },
  "alignment": "start"
}
